GUU ML	Continuity Irish Debating Council	grmy krbyn	UCD Law A
Cracking open a cold one with the goys	"Briefly..."	Cambridge E	Ah, I see you've played knifey spooney before
tbc	Theresa May presents: Lady in the Streets, Freak in the Wheat	Daddy and his fidget spinner	I came here to take over Irish debating and miss the break on speaks, and I've to leave before the break
*Say in a Kiwi Accent* Incentive Structures	Ocsferday	TCD Phil C	Nicest legs in the Hist
Comey hold me closer in the backseat of your congressional special inquiry	Oxford Wonunain	Our Auditor is so middle class that he eats Supermac's Chicken tenders with a knife and fork	Synergistic Management Solutions and Chill
Nothing like a hot cup of covfefe in the morning	I'm Ashaned to admit it, but our case is Jack shit	Alpha Badgers	Eat Sleep Debate Repeat
